{
  "schema_version": "1.0",
  "inventory_id": "initial-runtime-territories",
  "status": "approved",
  "updated_at": "2026-08-17",
  "source_issue": "https://github.com/nishide-dev/h3fast/issues/11",
  "license_evidence": {
    "base_revision": "42ed227ee7df40d41602854ae760620d6eb651fe",
    "license_sha256": "59b99642b95ea21630e311198ddbfffbfe05aadba0c2f5d884cbdf4efcc90f44",
    "applicable_territory": "Worldwide excluding the European Union, United Kingdom, Republic of Korea, and United States of America",
    "evidence": [
      "https://huggingface.co/MiniMaxAI/MiniMax-H3/blob/42ed227ee7df40d41602854ae760620d6eb651fe/LICENSE",
      "docs/compliance/h3-license-boundary-review.md"
    ]
  },
  "legal_approval": {
    "state": "approved",
    "owner": "nishide-dev (project-owner self-attestation)",
    "deadline": "2026-08-31",
    "approved_at": "2026-08-16T03:44:25+09:00",
    "evidence": [
      "https://github.com/nishide-dev/h3fast/issues/11#issuecomment-5303694328",
      "docs/decisions/0007-japan-local-h3-use-scope.md"
    ]
  },
  "flows": [
    {
      "id": "development-host",
      "description": "Japan-local developer workstation and remote workspace used for H3Fast and local H3 work",
      "location_scope": "countries",
      "country_codes": [
        "JP"
      ],
      "territory_assessment": "within-applicable",
      "h3_relation": "h3-works",
      "decision": "approved-under-community-license",
      "written_license": null,
      "operator": "nishide-dev",
      "owner": "nishide-dev",
      "deadline": "2026-08-31",
      "evidence": [
        "docs/compliance/h3-license-boundary-review.md",
        "https://github.com/nishide-dev/h3fast/issues/11#issuecomment-5303694328"
      ],
      "notes": "The project owner declared both the development machine and remote access origin to be in Japan. Approval is limited to the declared single-operator local-research scope."
    },
    {
      "id": "gpu-benchmark-host",
      "description": "Japan-local GPU host used for the fixed H3 baseline and resident-layer candidate",
      "location_scope": "countries",
      "country_codes": [
        "JP"
      ],
      "territory_assessment": "within-applicable",
      "h3_relation": "both",
      "decision": "approved-under-community-license",
      "written_license": null,
      "operator": "nishide-dev",
      "owner": "nishide-dev",
      "deadline": "2026-08-31",
      "evidence": [
        "docs/experiments/0003-rtx6000-ada-measured-baseline.md",
        "docs/experiments/0005-rtx6000-ada-resident40.md",
        "https://github.com/nishide-dev/h3fast/issues/11#issuecomment-5303694328"
      ],
      "notes": "The project owner declared the GPU machine and its operator to be in Japan. This approval does not cover remote execution from or access by an Excluded Territory."
    },
    {
      "id": "gpu-benchmark-host-secondary",
      "description": "Second Japan-local GPU host used by the same operator for exploratory H3 runs outside the pinned benchmark protocol",
      "location_scope": "countries",
      "country_codes": [
        "JP"
      ],
      "territory_assessment": "within-applicable",
      "h3_relation": "both",
      "decision": "approved-under-community-license",
      "written_license": null,
      "operator": "nishide-dev",
      "owner": "nishide-dev",
      "deadline": "2026-08-31",
      "evidence": [
        "docs/experiments/0007-japanese-dialogue-probe.md",
        "https://github.com/nishide-dev/h3fast/issues/11#issuecomment-5303694328"
      ],
      "notes": "The project owner declared this host to sit in Japan under the same single-operator conditions as the primary GPU host, with a shared home filesystem and no third-party access. Runs on this host are exploratory and must not be compared against pinned benchmark protocol results. This approval does not cover remote execution from or access by an Excluded Territory."
    },
    {
      "id": "github-actions",
      "description": "GitHub-hosted Ubuntu runners executing CPU-only pull request checks",
      "location_scope": "unknown",
      "country_codes": [],
      "territory_assessment": "not-applicable",
      "h3_relation": "none",
      "decision": "not-applicable",
      "written_license": null,
      "operator": "GitHub",
      "owner": "nishide-dev",
      "deadline": "2026-08-31",
      "evidence": [
        ".github/workflows/ci.yml",
        "https://docs.github.com/en/actions/reference/runners/github-hosted-runners"
      ],
      "notes": "This CPU-only workflow uses synthetic fixtures and neither downloads nor executes H3. Its runner region is outside the H3 territory decision."
    },
    {
      "id": "source-storage",
      "description": "Public GitHub.com repository storing H3Fast source and documentation",
      "location_scope": "countries",
      "country_codes": [
        "US"
      ],
      "territory_assessment": "not-applicable",
      "h3_relation": "none",
      "decision": "not-applicable",
      "written_license": null,
      "operator": "GitHub",
      "owner": "nishide-dev",
      "deadline": "2026-08-31",
      "evidence": [
        "https://docs.github.com/en/enterprise-cloud@latest/admin/data-residency/about-github-enterprise-cloud-with-data-residency",
        "docs/compliance/h3-license-boundary-review.md"
      ],
      "notes": "The repository contains independently authored Apache-2.0 code and metadata, not H3 Works. H3 territory restrictions do not govern this storage flow."
    },
    {
      "id": "ci-artifact-storage",
      "description": "GitHub Actions logs and transient build outputs for CPU-only checks",
      "location_scope": "countries",
      "country_codes": [
        "US"
      ],
      "territory_assessment": "not-applicable",
      "h3_relation": "none",
      "decision": "not-applicable",
      "written_license": null,
      "operator": "GitHub",
      "owner": "nishide-dev",
      "deadline": "2026-08-31",
      "evidence": [
        ".github/workflows/ci.yml",
        "https://docs.github.com/en/organizations/managing-organization-settings/configuring-the-retention-period-for-github-actions-artifacts-and-logs-in-your-organization"
      ],
      "notes": "Actions logs and transient CPU build data contain no H3 Materials or Outputs, so their storage region is outside the H3 territory decision."
    },
    {
      "id": "benchmark-output-storage",
      "description": "Japan-local repository-external storage for generated media and raw benchmark bundles",
      "location_scope": "countries",
      "country_codes": [
        "JP"
      ],
      "territory_assessment": "within-applicable",
      "h3_relation": "output",
      "decision": "approved-under-community-license",
      "written_license": null,
      "operator": "nishide-dev",
      "owner": "nishide-dev",
      "deadline": "2026-08-31",
      "evidence": [
        "docs/compliance/artifact-register.md",
        "https://github.com/nishide-dev/h3fast/issues/11#issuecomment-5303694328"
      ],
      "notes": "H3 snapshot, benchmark artifacts, and Outputs remain in the declared Japan-local research environment and are excluded from Git and third-party access."
    },
    {
      "id": "public-source-distribution",
      "description": "Global access to public H3Fast source, schema, protocol, and documentation",
      "location_scope": "global",
      "country_codes": [],
      "territory_assessment": "not-applicable",
      "h3_relation": "none",
      "decision": "not-applicable",
      "written_license": null,
      "operator": "GitHub",
      "owner": "nishide-dev",
      "deadline": "2026-08-31",
      "evidence": [
        "https://github.com/nishide-dev/h3fast",
        "docs/compliance/h3-license-boundary-review.md"
      ],
      "notes": "Global distribution covers independently authored Apache-2.0 code and metadata only. It does not distribute H3 Works, Model Derivatives, or Outputs."
    },
    {
      "id": "initial-user-access",
      "description": "Global access to the H3Fast Python package without H3 Materials",
      "location_scope": "global",
      "country_codes": [],
      "territory_assessment": "not-applicable",
      "h3_relation": "none",
      "decision": "not-applicable",
      "written_license": null,
      "operator": "Public package and source hosts",
      "owner": "nishide-dev",
      "deadline": "2026-08-31",
      "evidence": [
        "https://github.com/nishide-dev/h3fast/issues/11"
      ],
      "notes": "Package access is distinct from obtaining or running H3. Runtime execution remains a separate H3-related flow below."
    },
    {
      "id": "runtime-execution",
      "description": "Current single-operator local execution of H3 and the H3Fast runtime in Japan",
      "location_scope": "countries",
      "country_codes": [
        "JP"
      ],
      "territory_assessment": "within-applicable",
      "h3_relation": "h3-works",
      "decision": "approved-under-community-license",
      "written_license": null,
      "operator": "nishide-dev",
      "owner": "nishide-dev",
      "deadline": "2026-08-31",
      "evidence": [
        "https://github.com/nishide-dev/h3fast/issues/11#issuecomment-5303694328"
      ],
      "notes": "Approval covers only nishide-dev executing locally in Japan. Public BYOW users, Hosted Services, and third-party access require a new territory review."
    },
    {
      "id": "output-use",
      "description": "Current local storage, review, and use of generated H3 Outputs in Japan",
      "location_scope": "countries",
      "country_codes": [
        "JP"
      ],
      "territory_assessment": "within-applicable",
      "h3_relation": "output",
      "decision": "approved-under-community-license",
      "written_license": null,
      "operator": "nishide-dev",
      "owner": "nishide-dev",
      "deadline": "2026-08-31",
      "evidence": [
        "https://github.com/nishide-dev/h3fast/issues/11#issuecomment-5303694328"
      ],